Job Title,Required Skills,Responsibilities
Environmental Health Specialist,"Environmental regulations, inspections",- Conduct environmental assessments and inspections.<br>- Monitor and enforce compliance with environmental regulations.<br>- Assess and mitigate environmental health risks in communities.
Technical Writer,"Technical documentation, user manuals",- Create user-friendly technical documentation and guides.<br>- Explain complex technical concepts in clear and concise language.<br>- Collaborate with technical teams to gather information.
Event Coordinator,"Event planning, logistics, vendor management","- Plan and organize events according to client specifications.<br>- Coordinate logistics, including venue setup and vendor coordination.<br>- Ensure events run smoothly and meet client expectations."
UX Research Assistant,"User research, data collection",- Assist in conducting user research to gather insights.<br>- Gather and analyze data to understand user behavior and preferences.<br>- Support the development of user-centered design solutions.
Sustainability Consultant,"Sustainability strategies, environmental impact",- Develop and implement sustainability strategies for businesses.<br>- Assess environmental impact and recommend sustainable practices.<br>- Collaborate with clients to achieve sustainability goals.
Occupational Therapy Aide,"Therapy support, patient assistance",- Assist occupational therapists in setting up therapy sessions.<br>- Prepare therapy materials and provide patient support.<br>- Maintain a clean and organized therapy environment.
Financial Analyst,"Financial modeling, data analysis, forecasting",- Analyze financial data to assess investment opportunities.<br>- Develop and recommend investment strategies and portfolio adjustments.<br>- Prepare reports and presentations for clients.
Mechanical Technician,"Equipment maintenance, technical support",- Maintain and repair mechanical equipment and systems.<br>- Perform preventive maintenance and troubleshoot issues.<br>- Provide technical support to resolve equipment malfunctions.
Nurse Midwife,"Midwifery knowledge, maternal care, labor support",- Provide comprehensive care to pregnant women and deliver babies.<br>- Monitor maternal and fetal health during pregnancy and childbirth.<br>- Offer postpartum care and support.
Art Director,"Creative direction, visual design, team leadership",- Provide creative direction and oversee visual design projects.<br>- Manage a team of designers and collaborate with clients.<br>- Ensure design concepts align with project objectives.
Network Administrator,"Network maintenance, troubleshooting, security",- Maintain and troubleshoot network infrastructure and systems.<br>- Implement security measures to safeguard systems and data.<br>- Provide technical support to network users.
Chemist,"Chemical analysis, laboratory techniques, research",- Perform chemical analyses on samples and substances.<br>- Develop and improve chemical processes and formulas.<br>- Conduct research and experiments to advance scientific knowledge.
IT Trainer,"Technical training, curriculum development",- Develop training materials and curriculum for technical topics.<br>- Deliver training sessions to educate users on software and systems.<br>- Provide support and guidance during training exercises.
Healthcare Administrator,"Healthcare management, operations oversight","- Oversee the operations of healthcare facilities and services.<br>- Manage budgets, staffing, and compliance with regulations.<br>- Collaborate with medical staff to ensure high-quality patient care."
Architectural Drafter,"CAD software, architectural drawings",- Create detailed architectural drawings and blueprints.<br>- Assist architects in developing design concepts and plans.<br>- Use CAD software to accurately represent design specifications.
Occupational Health Manager,"Workplace health programs, regulations",- Develop and implement workplace health and safety programs.<br>- Ensure compliance with occupational health regulations.<br>- Assess workplace environments for health and safety risks.
Business Development Manager,"Sales strategies, client acquisition",- Develop and implement business development strategies.<br>- Identify new business opportunities and potential clients.<br>- Build and maintain relationships to drive client acquisition.
Epidemiologist,"Epidemiological research, data analysis",- Conduct research to study disease patterns and health trends.<br>- Analyze data to identify causes and risk factors for diseases.<br>- Communicate findings to inform public health decisions.
IT Project Manager,"Project management, stakeholder coordination","- Plan, execute, and monitor IT projects from initiation to completion.<br>- Coordinate project teams and manage stakeholder communication.<br>- Ensure projects are delivered on time and within scope."
Pharmacy Technician,"Medication dispensing, prescription processing",- Assist pharmacists with medication preparation and dispensing.<br>- Process prescription orders and provide patient education.<br>- Maintain inventory and ensure accurate recordkeeping.
Architectural Project Manager,"Project management, design coordination","- Lead architectural projects from concept to completion.<br>- Coordinate design teams, contractors, and project stakeholders.<br>- Manage budgets, schedules, and ensure project quality."
Content Strategist,"Content planning, brand messaging",- Develop content strategies to align with brand messaging.<br>- Plan and create content for various platforms and campaigns.<br>- Optimize content for engagement and brand consistency.
Mechanical Maintenance Technician,"Equipment maintenance, repairs",- Maintain and repair mechanical equipment and machinery.<br>- Perform routine maintenance tasks to ensure optimal performance.<br>- Troubleshoot and resolve mechanical issues as they arise.
Occupational Health Nurse,"Occupational health, health assessments",- Provide occupational health services and wellness programs.<br>- Conduct health assessments and screenings for employees.<br>- Promote workplace safety and provide health education.
Market Researcher,"Market analysis, data collection, consumer insights",- Conduct market research to gather consumer insights.<br>- Analyze data to identify trends and preferences.<br>- Present findings to support marketing and business strategies.
Operations Analyst,"Operations analysis, process optimization",- Analyze business operations to identify opportunities for improvement.<br>- Develop and implement process optimization strategies.<br>- Monitor operational efficiency and recommend changes.
